{
  "$schema": "https://raw.githubusercontent.com/horn111/base-attribution-os/main/proof-set.schema.json",
  "schemaVersion": 1,
  "title": "Stack the Bag",
  "builderCode": "bc_4pe6m33m",
  "generatedAt": "2026-08-28T19:03:04.035Z",
  "ok": true,
  "reports": [
    {
      "ok": true,
      "builderCode": "bc_4pe6m33m",
      "chainId": 84532,
      "network": "Base Sepolia",
      "generatedAt": "2026-08-28T19:03:03.230Z",
      "total": 1,
      "attributed": 1,
      "missing": 0,
      "wrongCode": 0,
      "invalid": 0,
      "unavailable": 0,
      "verified": 1,
      "unverified": 0,
      "coverage": 100,
      "transactions": [
        {
          "hash": "0xbf4fe264069c3e59c510d90ae2d306e121a8615e4364ac675634ea9b7635f3d9",
          "calldata": "0xa1510c31000000000000000000000000000000000000000000000000000000000000004000000000000000000000000000000000000000000000000000000000000002e000000000000000000000000000000000000000000000000000000000000000020000000000000000000000009b53e015f4c454881f88ec727fd0c0358bfababc149dbac75324c4364b6f366761afee50d712b2f408d2cb528bf2e01b69e01e870000000000000000000000000000000000000000000000000000000000000001000000000000000000000000000000000000000000000000000000000000000100000000000000000000000000000000000000000000000000000000000000000000000000000000000000000000000000000000000000000000000000000001000000000000000000000000000000000000000000000000000000000000000100000000000000000000000000000000000000000000000000001041af6869aa000000000000000000000000000000000000000000000000000000006a8a08a50000000000000000000000000000000000000000000000000000000000014a340000000000000000000000009b53e015f4c454881f88ec727fd0c0358bfababc149dbac75324c4364b6f366761afee50d712b2f408d2cb528bf2e01b69e01e870000000000000000000000000000000000000000000000000000000000000001000000000000000000000000000000000000000000000000000000000000000200000000000000000000000000000000000000000000000000000000000000000000000000000000000000000000000000000000000000000000000000000001000000000000000000000000000000000000000000000000000000000000000100000000000000000000000000000000000000000000000000001041af6869ab000000000000000000000000000000000000000000000000000000006a8a08a50000000000000000000000000000000000000000000000000000000000014a340000000000000000000000000000000000000000000000000000000000000002000000000000000000000000000000000000000000000000000000000000004000000000000000000000000000000000000000000000000000000000000000c00000000000000000000000000000000000000000000000000000000000000041451019aefdd61e0d4768a69c17e12b1367bb4a6dc07c5fba9f5805cc665d09914754a5f996af09d35c24e7f534dd7d5a7475dfc8887cdb7752ed10ed03067eb81c000000000000000000000000000000000000000000000000000000000000000000000000000000000000000000000000000000000000000000000000000041247399c960355929cf562663ea5879dd17fa09250ad09e42b2180248261fdbcb69c4b7c8b8f8696da4dd84233cb38dc3d444fb1e4a31d495a748e7a8058239611c0000000000000000000000000000000000000000000000000000000000000062635f347065366d33336d0b0080218021802180218021802180218021",
          "verified": true,
          "blockNumber": 45830947,
          "source": "Stack the Bag · direct batch mint",
          "status": "attributed",
          "codes": ["bc_4pe6m33m"],
          "schemaId": 0,
          "explorerUrl": "https://sepolia.basescan.org/tx/0xbf4fe264069c3e59c510d90ae2d306e121a8615e4364ac675634ea9b7635f3d9"
        }
      ]
    },
    {
      "ok": true,
      "builderCode": "bc_4pe6m33m",
      "chainId": 84532,
      "network": "Base Sepolia",
      "generatedAt": "2026-08-28T19:03:04.035Z",
      "total": 1,
      "attributed": 1,
      "missing": 0,
      "wrongCode": 0,
      "invalid": 0,
      "unavailable": 0,
      "verified": 1,
      "unverified": 0,
      "coverage": 100,
      "transactions": [
        {
          "hash": "0x534565e9cb01aa799a248ec30e01c38c14d8e9060c72c3b90493a6a26a3f46d8",
          "calldata": "0x34fcd5be0000000000000000000000000000000000000000000000000000000000000020000000000000000000000000000000000000000000000000000000000000000100000000000000000000000000000000000000000000000000000000000000200000000000000000000000004c6a09bb4bd8435350f6d5a1e7fd67fb2bc3d52f000000000000000000000000000000000000000000000000000000000000000000000000000000000000000000000000000000000000000000000000000000600000000000000000000000000000000000000000000000000000000000000264a1510c31000000000000000000000000000000000000000000000000000000000000004000000000000000000000000000000000000000000000000000000000000001a0000000000000000000000000000000000000000000000000000000000000000100000000000000000000000058638325a657fedfce35264fe253abbae56bcdd4149dbac75324c4364b6f366761afee50d712b2f408d2cb528bf2e01b69e01e87000000000000000000000000000000000000000000000000000000000000000400000000000000000000000000000000000000000000000000000000000000000000000000000000000000000000000000000000000000000000000000000005000000000000000000000000000000000000000000000000000000000000000100000000000000000000000000000000000000000000000000000000000000000000000000000000000000000000000000000000000000000000000000000025000000000000000000000000000000000000000000000000006a8b56710000000000000000000000000000000000000000000000000000000000014a34000000000000000000000000000000000000000000000000000000000000000100000000000000000000000000000000000000000000000000000000000000200000000000000000000000000000000000000000000000000000000000000041b8f7b6ac8f970d91a0629b7134e9d2418148bc374a2be75b9bc53a67c4f5c5df05d09eb3a4129077c49624ce4f0d99ed3bb712e9eef79985125e47b585bce7f01b000000000000000000000000000000000000000000000000000000000000000000000000000000000000000000000000000000000000000062635f347065366d33336d0b0080218021802180218021802180218021",
          "verified": true,
          "blockNumber": 45873720,
          "source": "Stack the Bag · Coinbase Smart Wallet/ERC-4337 mint",
          "status": "attributed",
          "codes": ["bc_4pe6m33m"],
          "schemaId": 0,
          "explorerUrl": "https://sepolia.basescan.org/tx/0x534565e9cb01aa799a248ec30e01c38c14d8e9060c72c3b90493a6a26a3f46d8"
        }
      ]
    }
  ],
  "summary": {
    "reports": 2,
    "networks": [
      {
        "chainId": 84532,
        "network": "Base Sepolia",
        "reports": 2,
        "transactions": 2
      }
    ],
    "total": 2,
    "attributed": 2,
    "missing": 0,
    "wrongCode": 0,
    "invalid": 0,
    "unavailable": 0,
    "verified": 2,
    "unverified": 0,
    "coverage": 100
  }
}
