{
  "$schema": "https://raw.githubusercontent.com/horn111/base-attribution-os/main/proof-set.schema.json",
  "schemaVersion": 1,
  "title": "Base Attribution OS",
  "builderCode": "bc_vwmzy653",
  "generatedAt": "2026-08-23T18:26:48.447Z",
  "ok": true,
  "reports": [
    {
      "ok": true,
      "builderCode": "bc_vwmzy653",
      "chainId": 8453,
      "network": "Base mainnet",
      "generatedAt": "2026-08-23T18:26:48.447Z",
      "total": 1,
      "attributed": 1,
      "missing": 0,
      "wrongCode": 0,
      "invalid": 0,
      "unavailable": 0,
      "verified": 1,
      "unverified": 0,
      "coverage": 100,
      "transactions": [
        {
          "hash": "0x6573344cfb346c886806804fb8f8b6cc510c30d7974a1a69c11452a5f8fe4926",
          "calldata": "0x62635f76776d7a793635330b0080218021802180218021802180218021",
          "verified": true,
          "blockNumber": "0x2dd765d",
          "status": "attributed",
          "codes": ["bc_vwmzy653"],
          "schemaId": 0,
          "explorerUrl": "https://basescan.org/tx/0x6573344cfb346c886806804fb8f8b6cc510c30d7974a1a69c11452a5f8fe4926"
        }
      ]
    }
  ],
  "summary": {
    "reports": 1,
    "networks": [
      {
        "chainId": 8453,
        "network": "Base mainnet",
        "reports": 1,
        "transactions": 1
      }
    ],
    "total": 1,
    "attributed": 1,
    "missing": 0,
    "wrongCode": 0,
    "invalid": 0,
    "unavailable": 0,
    "verified": 1,
    "unverified": 0,
    "coverage": 100
  }
}
